Question,Answer 1,Answer 2,Answer 3,Answer 4,Correct Answer
In the year 1900 in the U.S. what were the most popular first names given to boy and girl babies?,William and Elizabeth,Joseph and Catherine,John and Mary,George and Anne,John and Mary
When did the Liberty Bell get its name?,"when it was made, in 1701","when it rang on July 4, 1776","in the 19th century, when it became a symbol of the abolition of slavery",none of the above,"in the 19th century, when it became a symbol of the abolition of slavery"
"In the Roy Rogers -Dale Evans Museum, you will find Roy and Dales stuffed horses. Roy's horse was named Trigger, which was Dales horse?",Buttermilk,Daisy,Scout,Tulip,Buttermilk
The Daniel Boon museum at the home where he died can best be described how?,a log cabin in Kentucky,a two-story clapboard house in Tennessee,a four-story Georgian-style home in Missouri,a three story brick house in Arkansas,a four-story Georgian-style home in Missouri
Which of the following items was owned by the fewest U.S. homes in 1990?,home computer,compact disk player,cordless phone,dishwasher,compact disk player
